,id,created_at,text
838,1503560976947425285,2022-03-15 02:37:26+00:00,"Only in Canada, increasingly. And not least because of your newspaper @globeandmail https://t.co/iXrp9N7xHj"
839,1503560164544323584,2022-03-15 02:34:12+00:00,Expect more of this. https://t.co/X3PLezzoSt
840,1503559060154634241,2022-03-15 02:29:49+00:00,"RT @mysteriouskat: Maria Ovsyanikova, an employee of Russian state TV who waved anti-war messages during an on-air broadcast, also recorded…"
841,1503558337497116677,2022-03-15 02:26:57+00:00,"RT @AlexEpstein: These anti-humans at #SXSW have reality exactly backward.

Human beings aren't parasite-polluters who deplete and dirty th…"
842,1503557547315376132,2022-03-15 02:23:48+00:00,Meanwhile in Canada @JustinTrudeau doubles down https://t.co/4CQg4pryoW
843,1503556586148618245,2022-03-15 02:19:59+00:00,Please do. The sooner the better @PierrePoilievre https://t.co/SS5cNMO7Oe
844,1503553454295420933,2022-03-15 02:07:32+00:00,Russell Firebrand @rustyrockets This Is A Tipping Point https://t.co/GD26fkZD9D via @YouTube warning of Towers of Babel.
845,1503541185847115776,2022-03-15 01:18:47+00:00,Russian Oligarch Warns World Faces Food Crisis Due to Ukraine Invasion https://t.co/M4EhBaSJto
846,1503540937968037890,2022-03-15 01:17:48+00:00,And in Portugal...  https://t.co/2W8NrbdAeI
847,1503540205281845249,2022-03-15 01:14:54+00:00,That would be good. I hope it's possible. https://t.co/7WhxT14RMG
848,1503539632369250310,2022-03-15 01:12:37+00:00,Due as well to purposeful demoralization of the young. https://t.co/8sBSAQnxUR
849,1503539198808240135,2022-03-15 01:10:54+00:00,Centralizing personalized purchasing data is a very very very bad idea. https://t.co/6iuK99yDwD
850,1503538970709405701,2022-03-15 01:09:59+00:00,To full extent. https://t.co/8QnMYg7piK
851,1503538689619681281,2022-03-15 01:08:52+00:00,"RT @jkenney: The world is waking up to the importance of energy security. 

Europe is moving away from conflict energy.

It's past time for…"
852,1503538088198520834,2022-03-15 01:06:29+00:00,"RT @BarbaraRKay: So CRT says ALL white people are racist whether they think they are or not. is this what kids should be learning? BTW, whe…"
853,1503537982669791235,2022-03-15 01:06:04+00:00,RT @glass_zealot: https://t.co/sE264jlT2Y
854,1503537752196927488,2022-03-15 01:05:09+00:00,Along with serious supply chain disruption from the Covid mandates you supported @globeandmail https://t.co/tVweCjtcN3
855,1503537374600605700,2022-03-15 01:03:39+00:00,RT @pmarca: TFW you haven't yet figured out what those awful people in the other 21 states are up to. https://t.co/Yb2jAr3dcD
856,1503536081496641544,2022-03-15 00:58:30+00:00,RT @VPrasadMDMPH: While California is poised to mandate covid shots for public school kids-- potentially throwing out thousands of kids bas…
857,1503535800180379649,2022-03-15 00:57:23+00:00,"Mr. Maher, I warned you about such things five years ago. And you were polite but not convinced @billmaher. And I'm… https://t.co/yGzuA9OMj6"
858,1503534933494673414,2022-03-15 00:53:57+00:00,Very little is still stunning @BretWeinstein https://t.co/azZxhOBNEv
859,1503534765730930690,2022-03-15 00:53:17+00:00,"RT @ShellenbergerMD: We are building a movement that transcends Left and Right

Keys:

— Statewide psych/addiction care

— Shelter First, H…"
860,1503534710949097478,2022-03-15 00:53:04+00:00,RT @sunlorrie: Bank Of Canada Governor: Carbon tax boosts inflation rate by nearly half-a-point https://t.co/GgebesDRvI https://t.co/LyDDDV…
861,1503534368622579718,2022-03-15 00:51:42+00:00,And now I've retweeted her comments I'm a bully and she threatens my wife and kids. https://t.co/zI4GrimbB8
862,1503533539844886535,2022-03-15 00:48:24+00:00,My grandmother split that amount of wood every winter in Saskatchewan.... she showed me a photo. A woodpile as wide… https://t.co/WBjCDxKJCm
863,1503533020762058762,2022-03-15 00:46:21+00:00,Why is it so often those on the compassionate left who hate the working class when they dare to have opinions? https://t.co/gK1fw8U0Hv
864,1503532716016508932,2022-03-15 00:45:08+00:00,"""defending democracy"" @JustinTrudeau https://t.co/U9QU3Aywfu"
865,1503532614845612037,2022-03-15 00:44:44+00:00,RT @glass_zealot: What is your favorite unknown cathedral? Mine is Albi Cathedral https://t.co/XbRTeF3m9O
866,1503532471249420298,2022-03-15 00:44:10+00:00,"RT @realchrisrufo: Here's the original reporting at NBC-San Antonio:
https://t.co/314n4dZHZj"
867,1503530893167767553,2022-03-15 00:37:53+00:00,The words of a person to whom we are invited to believe black lives matter (info in bio) in some meaningfully moral… https://t.co/0A4jdDpfpE
868,1503528764373876739,2022-03-15 00:29:26+00:00,"I think that the fact that you refer so casually to ""legitimately stupid people"" and with such contempt pretty much… https://t.co/xhRzgu8xco"
869,1503527265983991808,2022-03-15 00:23:29+00:00,@mehdirhasan And just out of curiosity which of my stupid ideas convinced you of that? Something I actually said or… https://t.co/59PDuCnf3I
870,1503526761694441472,2022-03-15 00:21:28+00:00,@notleonardzelig @mehdirhasan As you've just proved.
871,1503526640835567617,2022-03-15 00:21:00+00:00,"Self described ""peacemonger"" practicing his anonymous craft. https://t.co/u0sORtyI9V"
872,1503525944769892355,2022-03-15 00:18:14+00:00,Why don't you watch this and then tell me how unsavoury I am and how weak my ideas are https://t.co/GCWtukDCoE and… https://t.co/JFs6BEvAvZ
873,1503523611704967169,2022-03-15 00:08:57+00:00,Into the abyss to find your father  https://t.co/GCWtukDCoE via @YouTube
874,1503519143768866816,2022-03-14 23:51:12+00:00,Do you have to plagiarize even your insults @mehdirhasan? https://t.co/AaDrZZDXSP
875,1503518144140353536,2022-03-14 23:47:14+00:00,@GeraldKutney @drfeedbacker Here's something to ponder while you do so https://t.co/g8BnDzVQ7M
876,1503517845170409472,2022-03-14 23:46:02+00:00,@GeraldKutney @drfeedbacker Address his point. Coal is preferable to dung and wood. And it's cheap. Then switch to… https://t.co/Zd3LUFEJ9W
877,1503516930501656587,2022-03-14 23:42:24+00:00,We could have promoted fracking as a transition to nuclear (and to coal). But foolish moralizing prevailed. And now… https://t.co/QesTXf9JKP
878,1503516382188744712,2022-03-14 23:40:14+00:00,I can point directly now to much higher energy costs. And consequent extreme increases in food prices are inevitabl… https://t.co/tntiTgjWkL
879,1503514958444863490,2022-03-14 23:34:34+00:00,"Tens of trillions of dollars in unwarranted costs. And if you think this doesn't fall mostly on the poor, think aga… https://t.co/TK8lFYQclE"
880,1503514522660782082,2022-03-14 23:32:50+00:00,"Just when is the ""science"" settled? From Science magazine itself https://t.co/Zrd0qHAbhK https://t.co/cB3wxciedE"
881,1503513448134725635,2022-03-14 23:28:34+00:00,"RT @HumanProgress: ""Since 1920, Earth's average temperature has risen by 1.12 degrees and the world population has quadrupled from less tha…"
882,1503512352989364233,2022-03-14 23:24:13+00:00,"RT @DanCrenshawTX: The anti-fossil fuel talking points that you’ve heard from the left for years were likely written by the Russians.

The…"
883,1503511571301081100,2022-03-14 23:21:07+00:00,"RT @realchrisrufo: BREAKING: The Arizona State Senate has passed curriculum transparency legislation, which will require public schools to…"
884,1503511304476180481,2022-03-14 23:20:03+00:00,An honest diversity statement garners no grants. https://t.co/ejDzMgfkuB
885,1503511013274046466,2022-03-14 23:18:54+00:00,Yes. https://t.co/EeWv7IGp6F
886,1503510741239975940,2022-03-14 23:17:49+00:00,Freeze her bank account before it's too late. https://t.co/1Z74chxhUs
887,1503510334706966533,2022-03-14 23:16:12+00:00,Whatever makes energy cheaper is if primary benefit to the poor. Now. And now matters overwhelmingly if you're poor… https://t.co/l69pXsiGYS
888,1503509376119750658,2022-03-14 23:12:23+00:00,"RT @KeillerDon: So much for the “it will take 10 years to produce any shale gas” lies, from Kwarteng. 

https://t.co/VB8vqPp9vq https://t.c…"
889,1503505996097986561,2022-03-14 22:58:57+00:00,Unnecessarily punishing. https://t.co/DhtbJFVFLu
890,1503505055730786311,2022-03-14 22:55:13+00:00,RT @KeillerDon: True then and more true today. https://t.co/zslUI2rcr3
891,1503504944304992261,2022-03-14 22:54:47+00:00,"RT @ChivalryGuild: Want to know what effect your kind word can have on another person? 

Consider the example of CS Lewis and his friend JR…"
892,1503504095256186880,2022-03-14 22:51:24+00:00,Look who's found a power law phenomenon. https://t.co/hhIF5Q9bdu
893,1503503907405934597,2022-03-14 22:50:39+00:00,"You support fracking, for starters. Which lowered C02 emissions in the US, something many eco types claim to care a… https://t.co/I3ptplRyaR"
894,1503503311919624192,2022-03-14 22:48:17+00:00,The Politics of Climate Change | Steve E. Koonin https://t.co/f7QHCZuK2f via @YouTube
895,1503497722065784837,2022-03-14 22:26:05+00:00,"RT @akirathedon: Because if you're not going to speak up now
When ARE you going to?

THE MOB ft @DouglasKMurray

Music video out now!
https…"
896,1503497422412132354,2022-03-14 22:24:53+00:00,"""science"" https://t.co/F8stj9yRPV"
897,1503494640984633348,2022-03-14 22:13:50+00:00,"RT @realchrisrufo: Finally, I've written a CRT Briefing Book for parents and policymakers that defines the ideology, catalogs all of my inv…"
898,1503492701823676423,2022-03-14 22:06:08+00:00,Already compromised near fatally by Covid lockdowns: Ukraine war drops 'Iron Curtain' on global supply chains - Asi… https://t.co/l0MRWUjxz6
899,1503491887172403200,2022-03-14 22:02:54+00:00,Amazon relocates workers due to out-of-control violence in downtown Seattle https://t.co/4raxUegtgm
900,1503491720121626628,2022-03-14 22:02:14+00:00,Good luck @ShellenbergerMD https://t.co/evucXBOQld
901,1503491308173856771,2022-03-14 22:00:36+00:00,"Postmodern NeoMarxists: Ibram X Kendi, Ta-Nehisi-Coates, Robin DiAngelo, Kimberle Crenshaw, bell hooks, Andrea Dwor… https://t.co/h0aurL3Clc"
902,1503487239673856004,2022-03-14 21:44:26+00:00,https://t.co/XY2gFofunD
903,1503487130718412808,2022-03-14 21:44:00+00:00,Why Canadian gas prices are higher than ever (it's not all Ukraine) | Driving https://t.co/kpmxyOWezn
904,1503484830084141057,2022-03-14 21:34:51+00:00,"RT @CDNEnergyCentre: Once completed, the Trans Mountain Expansion will allow more responsibly-produced Canadian oil to reach key markets in…"
905,1503484743706361856,2022-03-14 21:34:30+00:00,Scientists! Are you awake yet? Didn't think so... https://t.co/xsbkjdvelq
906,1503431149741355009,2022-03-14 18:01:33+00:00,"Apparently the science isn't ""settled."" https://t.co/sOZvsC1uqt https://t.co/oHEm48fTOg"
907,1503428426648195075,2022-03-14 17:50:43+00:00,To mandate instruction in Critical Theory and Critical Race Theory under the guise of moral endeavour https://t.co/HNC4OpiodU
908,1503427406299910145,2022-03-14 17:46:40+00:00,Barbara Kay ⁦@BarbaraRKay⁩ sounding the alert. Are you listening ⁦@jkenney⁩ ⁦@fordnation⁩ ⁦@PremierScottMoe⁩ ⁦… https://t.co/2ls0tQRJkH
909,1503409587642417158,2022-03-14 16:35:52+00:00,"""Stop relying on"" meaning eating, travelling, heating, cooling, transporting, manufacturing... https://t.co/s96pgXtduD"
910,1503409126755422218,2022-03-14 16:34:02+00:00,"""Sustainable supply lines"" https://t.co/cg4XbnC55c"
911,1503408943447613443,2022-03-14 16:33:18+00:00,"How about we just ensure that it's super expensive, and that will solve the planet's problems. Unless you include t… https://t.co/Vn3De8MmC0"
912,1503405749438984194,2022-03-14 16:20:37+00:00,https://t.co/ixyIRL55jd
913,1503405724852002818,2022-03-14 16:20:31+00:00,Origins of the patriarchy with @ProfDavidBuss. From the latest podcast episode. https://t.co/OZNf8Ciu81
914,1503405514801176576,2022-03-14 16:19:41+00:00,"The Evolution of Desire | David Buss | The JBP Podcast | #235 with @ProfDavidBuss.

https://t.co/ixyIRL55jd https://t.co/f68wyYjn8o"
915,1503397675911323660,2022-03-14 15:48:32+00:00,"RT @sunlorrie: The Prime Minister had every right to release this video promoting his European trip last week, just as journalists who went…"
916,1503397445144879115,2022-03-14 15:47:37+00:00,Fools double down in the face of contradictory evidence @JustinTrudeau https://t.co/4iGsYCPMZP
917,1503396017059864581,2022-03-14 15:41:56+00:00,Can Canada shed its addiction to idiot falsely moralizing climate change mitigation policies? https://t.co/ufVwIHdm6T
918,1503384837192753154,2022-03-14 14:57:31+00:00,It does. But why should that contradiction bother those who reject the necessity or even the existence of coherence? https://t.co/wCdTxztpL1
919,1503384534003294213,2022-03-14 14:56:19+00:00,"Now the objection will be ""these people don't agree on everything."" Who does? That doesn't mean that nothing core u… https://t.co/Ymfi3Q33dY"
920,1503383624644661249,2022-03-14 14:52:42+00:00,"No, you're the only person who knows such things. https://t.co/MBzJazgkn7"
921,1503383421141196804,2022-03-14 14:51:53+00:00,"""Anti-fact reality rejecters"" https://t.co/XCdkXuH5BI"
922,1503382081614729217,2022-03-14 14:46:34+00:00,"Foucault: more than a million citations. So he's not just in my head, darling. https://t.co/lT2mPoDVMK"
923,1503381890786463744,2022-03-14 14:45:48+00:00,@unlearn16tweet And so it's no surprise that your moniker is unlearn.
924,1503381656710774786,2022-03-14 14:44:53+00:00,I made this list public because I'm frequently criticized for being unable to name a single thinker whose thought e… https://t.co/CA9wUlNrTv
925,1503379310937186306,2022-03-14 14:35:33+00:00,This has got far worse ⁦@fordnation⁩ with the damnable Bill 67 https://t.co/79QquWYzOH https://t.co/uXlBceJ1sE
926,1503377664328953864,2022-03-14 14:29:01+00:00,I doubt that and no they decidedly are not. https://t.co/gx3Ceqs4MV
927,1503377297583181825,2022-03-14 14:27:33+00:00,Angela Davis.
928,1503375211076354050,2022-03-14 14:19:16+00:00,And Michel Foucault deserves to be listed twice.
929,1503375079127732234,2022-03-14 14:18:44+00:00,You're contemptible. https://t.co/7x0Mbedh4M
930,1503374960923799555,2022-03-14 14:18:16+00:00,Michel Foucault: cited more than a million times. You haven't got a clue. https://t.co/Yh2M2pV6DT
931,1503374791314604038,2022-03-14 14:17:36+00:00,Another genius who assumes my presumptive comparative illiteracy proves him both correct and moral. https://t.co/FXThRAFeTE
932,1503373272917823490,2022-03-14 14:11:34+00:00,Just as Nietzsche claimed in his brilliant work on ressentiment. Just as Solzhenitsyn claimed in The Gulag Archipel… https://t.co/kvtesCM5YV
933,1503372605671284739,2022-03-14 14:08:55+00:00,@sociolos The list is indefinitely expandable.
934,1503372241437806594,2022-03-14 14:07:28+00:00,"I don't ""miss"" this. I don't buy it. Any of it. I believe it's technically wrong, in that institutions built on pow… https://t.co/8wfQ96W7md"
935,1503371350718656514,2022-03-14 14:03:55+00:00,"@sociolos Ibram X Kendi, Ta-Nahesi-Coates, Robin DiAngelo, Kimberle Crenshaw, bell hooks, Andrea Dworkin, Michel Fo… https://t.co/35NqBWA2IS"
936,1503368335932723204,2022-03-14 13:51:57+00:00,"The same line of thought runs through Jung's work (and M Eliade, E Neumann, J Campbell). Those thinkers concluded t… https://t.co/QM4T8moOIV"
937,1503367556475748352,2022-03-14 13:48:51+00:00,There is an element of postmodern thought I believe to be true although I think the New England pragmatists followi… https://t.co/N3onyN73WR
938,1503367057173213184,2022-03-14 13:46:52+00:00,So what unites us then? Nothing? Then we fight. https://t.co/dGD2V2ulLs
939,1503361002024415239,2022-03-14 13:22:48+00:00,And the insistence that the resultant inequality of groups must be resisted by all means possible including revolut… https://t.co/3xu79w0RXc
940,1503360262786764804,2022-03-14 13:19:52+00:00,"Any criticisms so far, leftist geniuses out there who've read and understood far more than me? Or have I given the devil his proper due?"
941,1503359684933300231,2022-03-14 13:17:34+00:00,And the inevitable and motivated exploitation that results
942,1503359525356818434,2022-03-14 13:16:56+00:00,And postmodern neomarxism is the claim that the only truth and grand ethic/narrative is the fact and motivated perp… https://t.co/4mMASDEHx5
943,1503358795992420354,2022-03-14 13:14:02+00:00,And this for Marxism: https://t.co/RNqV9ceEvQ
944,1503358357436043265,2022-03-14 13:12:18+00:00,Anybody who's a fan or whatever an admirer of postmodernism should be called want to suggest a better capsule summa… https://t.co/P73vR9i78m
945,1503199987714428931,2022-03-14 02:42:59+00:00,Zero anything is almost inevitably a slogan indicating poor policy.  https://t.co/pVVwVHwndB
946,1503199615948099585,2022-03-14 02:41:31+00:00,Yes @brianlilley but where's the data on feeling safe? And who can put a price on that? https://t.co/HIogqZKTke
947,1503199317754093576,2022-03-14 02:40:20+00:00,I can't even understand who is oppressing who anymore. https://t.co/iZxbtcuzNW
948,1503198943966113792,2022-03-14 02:38:50+00:00,The square root of the number of criminals commit half the crimes. A power law phenomenon. https://t.co/oo9b2b4klC
949,1503198645537157126,2022-03-14 02:37:39+00:00,Stop the tar sands! Make OPEC richer! Keep Europe dependent on Russia! Make energy expensive and unreliable! Sacrif… https://t.co/ht2LasxIBZ
950,1503198053209153537,2022-03-14 02:35:18+00:00,RT @EcoSenseNow: https://t.co/b50jMPTeDB
951,1503197792453419014,2022-03-14 02:34:16+00:00,Gee @CBCNews have you asked the same question about trust in Canada's banks after @JustinTrudeau took your lying jo… https://t.co/3rhT3ruKgC
952,1503196375856594944,2022-03-14 02:28:38+00:00,Ouch. https://t.co/GZXIcKQvc5
953,1503195970322026496,2022-03-14 02:27:02+00:00,"RT @BarbaraRKay: MORE BREAKING NEWS: The death certificates of most of the “missing” Kamloops Indian Residential Students have been found,…"
954,1503195597179863040,2022-03-14 02:25:33+00:00,"Try paying attention, then. Maybe you're the blind one. Do you support @JustinTrudeau ? Do you think the truckers w… https://t.co/AvJWZhka58"
955,1503194958253203457,2022-03-14 02:23:00+00:00,"""Pfizer's CEO says"" https://t.co/ZzNF559feR"
956,1503194823985176580,2022-03-14 02:22:28+00:00,And all those who won't frack etc. In the West keep the Saudis powerful beyond all reasonable proportion… https://t.co/gJWu7MiHgH
957,1503194371621101573,2022-03-14 02:20:40+00:00,"RT @GlennLoury: Rob Montz has made a terrific short doc on Harvard University's attempt to cancel Roland Fryer, one of the most outstanding…"
958,1503194318521212931,2022-03-14 02:20:28+00:00,They've allowed their guilt to be weaponized. And they're voting for the demise of their own ideals @BarbaraRKay an… https://t.co/Kj3dKqxabv
959,1503194042968027143,2022-03-14 02:19:22+00:00,An amazing man: @JustinTrudeau can talk through his hat and his mask simultaneously @ConradMBlack https://t.co/DyU7H79Vic
960,1503192963727470594,2022-03-14 02:15:05+00:00,Jordan Peterson gives stark warning against critical race theory bill for Ontario https://t.co/AsKWdTxWIl via @truenorthcentre
961,1503192761952047106,2022-03-14 02:14:17+00:00,"It's easier to kowtow @michaelshermer and we're doing everything we can to make that mandatory, particularly in Can… https://t.co/o3DdiLt3Ut"
962,1503192107061809153,2022-03-14 02:11:40+00:00,From the cited source https://t.co/YvLWaVCOkY
963,1503191491216355328,2022-03-14 02:09:14+00:00,This shows that the rot spread from the universities outward. https://t.co/HUeJVRczXi
964,1503191022003703825,2022-03-14 02:07:22+00:00,"Remember the idea that ""citizen"" was a worthy identity? https://t.co/ONfEYynvXL"
965,1503190691823947781,2022-03-14 02:06:03+00:00,It is far easier to destroy than to build. And the woke continue their destructive rampage. https://t.co/ddHIw0Rbmh
966,1503190280375349249,2022-03-14 02:04:25+00:00,The inevitable is now happening so fast that even The Atlantic can't ignore it. The education system is unbelievabl… https://t.co/8zm7ffNBjN
967,1503188447992979463,2022-03-14 01:57:08+00:00,Everything this teacher is accused of doing will be promoted if not required in every school in Ontario if Bill 67… https://t.co/Dev6wJakJ2
968,1503187339060858881,2022-03-14 01:52:44+00:00,If he had an ounce of integrity he'd resign. But if he had an ounce of integrity he wouldn't have run for PM on not… https://t.co/WhfczfNgln
969,1503185951480324107,2022-03-14 01:47:13+00:00,Inexcusable. A warning to everyone. https://t.co/Lg4qCcoE7M
970,1503185842784899072,2022-03-14 01:46:47+00:00,"""defending democracy "" says the man who bought the lies of his paid stooges at @CBCNews, froze bank accounts, false… https://t.co/uuvEYoFt71"
971,1503185090305794049,2022-03-14 01:43:48+00:00,"And too bad about the ""slippage"" in our democracy. Our PM is a posturing fool @JustinTrudeau and the world now know… https://t.co/PVGM7XCMOa"
972,1503184532987654146,2022-03-14 01:41:35+00:00,And too bad about the integrity of our much vaunted Charter. And too bad about the supporters of @JustinTrudeau pla… https://t.co/YtATlMR3kB
973,1503184219815690240,2022-03-14 01:40:20+00:00,"This means that the entire story @JustinTrudeau told to justify the ""emergency"" was an utter lie @CBCNews this is f… https://t.co/TlxhrhARbB"
974,1503163178599043077,2022-03-14 00:16:43+00:00,"""Anti-racist"" means ""committed adherent to CRT doctrines"" not ""non-racist"" (which is what you're supposed to think… https://t.co/eV1y43QBLU"
975,1503162544105660418,2022-03-14 00:14:12+00:00,Ontario parents: you need to understand that this bill is based on thinking so extreme that moderate US Democrats h… https://t.co/0YNTc1uMOD
976,1503161988574236676,2022-03-14 00:12:00+00:00,RT @spark_1953: Justice for johnny Depp Virginia 2022 https://t.co/KwkSkaZzEg
977,1503161775226765312,2022-03-14 00:11:09+00:00,Just wait until Bill 67 passes. And it will. @jonkay consider a bit of screaming ok? https://t.co/5n7XJhoIHn
978,1503161401803747332,2022-03-14 00:09:40+00:00,Oh. My. God. Not The Atlantic? Soon they'll report that plentiful inexpensive energy makes poor people rich and inc… https://t.co/zziTNywiui
979,1503160861598355458,2022-03-14 00:07:31+00:00,"Yes. As Jean Piaget demonstrated, by the way. It's also why psychopathy is, to put it mildly, a suboptimal strategy… https://t.co/hUPFEGRbSh"
980,1503159181620228097,2022-03-14 00:00:50+00:00,"I've done what I can to alert people. The conservatives don't even understand that the very term ""anti-racist"" is r… https://t.co/7KG9gAXGBl"
981,1503156298099142661,2022-03-13 23:49:23+00:00,I don't wonder. And it's going to get a lot worse @michaelshermer. The STEM types have no idea whatsoever what is h… https://t.co/vPUC35xB0F
982,1503155220800585730,2022-03-13 23:45:06+00:00,RT @HumanProgress: Child labor had been ubiquitous since time immemorial and finally began to come under scrutiny during the Victorian age.…
983,1503155134498750465,2022-03-13 23:44:45+00:00,Is Putin’s dream of annexing Ukraine over? https://t.co/5oBk9IAlpU via @spectator
984,1503155011093639170,2022-03-13 23:44:16+00:00,"IPCC climate models overestimate warming over five decades and appear to be getting worse not better. Why, indeed?… https://t.co/tL2FEjlF3E"
985,1503152105435111424,2022-03-13 23:32:43+00:00,Wasn't it CBC coverage that inspired the Emergency Act itself @jonkay @CBCNews ? Too bad about those people with th… https://t.co/hOlitBe3CQ
986,1503149324519235587,2022-03-13 23:21:40+00:00,"Here's a place to draw a line, a priori (that is, without personal experimentation). ""Don't rape destitute boys in… https://t.co/29QWY4QYUi"
987,1503148133664137217,2022-03-13 23:16:56+00:00,"And you mean ""change,"" not deny. https://t.co/IziQXSpEJs"
988,1503147786421866496,2022-03-13 23:15:34+00:00,You just go right ahead and correct me with your self-evidently accurate reading. https://t.co/IziQXSpEJs
989,1503147439078797314,2022-03-13 23:14:11+00:00,"Oh, I see now. It was all part of the great man's noble attempt to test limits. https://t.co/DqQGxLfdch"
990,1503147063730741253,2022-03-13 23:12:41+00:00,From a defender of Foucault https://t.co/tmG4q4742W https://t.co/wyFrHYmwP2
991,1503145476400586764,2022-03-13 23:06:23+00:00,"Clarification: he raped poor, destitute, desperate children while in a foreign land. And he did so in a graveyard.… https://t.co/TZdHavbgHJ"
992,1503144526097133574,2022-03-13 23:02:36+00:00,All these unknown anonymous geniuses listing everything they say they read. https://t.co/Ax4pasm3Dx
993,1503143945584488457,2022-03-13 23:00:18+00:00,"You meant to say ""those of us WHO read."" But keep right on lecturing me about my literacy."
994,1503142768360710144,2022-03-13 22:55:37+00:00,"I've read him. And I understood what I read. And him. In clinical detail. And that's why the resentful ""revolutiona… https://t.co/RFHRxwWevM"
995,1503142551406194693,2022-03-13 22:54:45+00:00,"And why, exactly (and I do mean exactly) in a graveyard? Do you really want to go there?"
996,1503142328705376257,2022-03-13 22:53:52+00:00,And give some thought to what it means that you defend this man. What are you defending? His specific actions (that… https://t.co/w7L9Yp47nM
997,1503139673656463362,2022-03-13 22:43:19+00:00,"I note that Foucault raped children in cemeteries and no one denies it. The response: ""you're bad."" Would a good ma… https://t.co/5AXXrwfGkc"
998,1503137812685766663,2022-03-13 22:35:56+00:00,Oh look. Critical Steve has an MEd. https://t.co/RQ7v5W7Wn1
999,1503137606036602883,2022-03-13 22:35:06+00:00,Another brave anonymous warrior. Saying things while safely hiding he would never say to anyone in person. https://t.co/f1z9AIklfu
